{
  "version": 1,
  "domain": "touchdesigner",
  "description": "TouchDesigner / show-control builds: node networks and generative visuals gated by a node-error scan and a performance budget instead of lint/typecheck/tests.",
  "nodes": {
    "architect": null,
    "techlead": null,
    "build": {
      "replace": [
        "ui_ux",
        "engineering",
        "media_eventtech"
      ],
      "add": [
        {
          "id": "media",
          "role": "build",
          "agentType": "godmode-media-eventtech",
          "personaFile": ".claude/agents/godmode-media-eventtech.md",
          "skills": [
            "godmode-eventtech",
            "bdbmediastorm",
            "mcp-manage",
            "pb-show-build"
          ],
          "artifactKey": "media",
          "writes": "production_artifacts/state.d/media.json",
          "instructions": "Build the TouchDesigner node network per the plan (TOP/CHOP chains, MCP scripting). Write production_artifacts/03_media_pipeline.md and the state.d fragment."
        }
      ]
    },
    "reviewer": null,
    "shipping": null
  },
  "gates": {
    "td-node-errors": "get_td_node_errors over the TouchDesigner network reports zero errors or warnings",
    "performance-budget": "The network meets the plan's fps/CPU budget, measured live, not eyeballed"
  },
  "artifacts": {
    "media": "production_artifacts/03_media_pipeline.md"
  },
  "selection": {
    "triggers": [
      "touchdesigner",
      "resolume",
      "grandma3",
      "show-control",
      "generative-visuals",
      "dmx",
      "tops",
      "chops",
      "node-network"
    ],
    "description": "Pick when the goal is a live-media or TouchDesigner build: node networks, show control, generative visuals."
  },
  "notes": "Reuses the existing godmode-media-eventtech agent and persona file; the trigger list mirrors the skill description wording so the Architect's plan gate can match goal text without regexes. Known persona gap: nodes need the TouchDesigner MCP server (node-error and perf probes), which no persona file covers yet."
}
